id,text,normalized_text,amount,pred_amount,type,category,language_style,difficulty,case_type
VX-SU-002950,poé ieu meunang duit tina proyék freelance hiji juta lima ratus rébu ka cash,poé ieu meunang duit tina proyék freelance hiji juta lima ratus rébu ke cash,1500000,1000000.0,income,Freelance,su,medium,wallet_mention
VX-SU-000263,kuring ojék online dua puluh dua rébu,kuring ojék online dua puluh dua rébu,22000,,expense,Transportasi,su,easy,expense_basic
VX-SU-001154,minggu ieu meuli roti sakitar dalapan rébu,minggu ieu beli rodari sakitar dalapan rébu,8000,,expense,Makan & Minum,su,easy,expense_basic
VX-SU-001702,narima gajih hiji juta lima ratus rébu,narima gajih hiji juta lima ratus rébu,1500000,1000000.0,income,Gaji,su,easy,income_basic
VX-SU-001355,minggu ieu balanja balanja bulanan sakitar Rp200.000,minggu ieu balanja balanja bulanan sakitar rp200 000,200000,,expense,Belanja,su,easy,expense_basic
VX-SU-001549,abdi aya duit asup Rp1.000.000 tina duit bulanan,abdi aya duit asup rp1 000 000 tina duit bulanan,1000000,,income,Gaji,su,easy,income_basic
VX-SU-001496,kuring alat tulis Rp25.000,kuring alat tulis rp25 000,25000,,expense,Belanja,su,easy,expense_basic
VX-SU-002344,poé ieu mayar angkot sakitar dua belas rebu,poé ieu bayar angkot sakitar dua belas ribu,12000,2000.0,expense,Transportasi,su,easy,transport_parkir_bensin
VX-SU-004731,kamari meunang Rp1.000.000 ngadamel website,kamari meunang rp1 000 000 ngadamel website,1000000,,income,Freelance,su,hard,ambiguous_hard_case
VX-SU-003221,kuring duit bulanan asup hiji juta lima ratus rébu ka bri,kuring duit bulanan asup hiji juta lima ratus rébu ke bri,1500000,1000000.0,income,Gaji,su,medium,wallet_mention
VX-SU-000201,mayar ojék online lima belas rébu,bayar ojék online lima belas rébu,15000,,expense,Transportasi,su,easy,expense_basic
VX-SU-004901,kuring mindahkeun saldo Rp1.000.000 tina dana ka bca,kuring mindahkeun saldo rp1 000 000 tina dana ke bca,1000000,,transfer,Transfer,su,hard,transfer_future_optional
